2025-11-21 10:56:30 - INFO - ============================================================
2025-11-21 10:56:30 - INFO - EXPERIMENT CONFIGURATION
2025-11-21 10:56:30 - INFO - ============================================================
2025-11-21 10:56:30 - INFO -   architecture: ResNet-18
2025-11-21 10:56:30 - INFO -   search_algorithm: bayesian
2025-11-21 10:56:30 - INFO -   num_trials: 20
2025-11-21 10:56:30 - INFO -   epochs: 60
2025-11-21 10:56:30 - INFO -   use_stl: True
2025-11-21 10:56:30 - INFO -   quality_constraint: 0.89
2025-11-21 10:56:30 - INFO -   energy_constraint: 5000.0
2025-11-21 10:56:30 - INFO -   search_space: {'num_stages': [4], 'blocks_per_stage': [2], 'base_filters': [64], 'mul_map_files': ['./multipliers/mul8u_1JJQ.bin', './multipliers/mul8u_LK8.bin']}
2025-11-21 10:56:30 - INFO -   timestamp: 20251121_105630
2025-11-21 10:56:30 - INFO - ----------------------------------------
2025-11-21 10:56:30 - INFO - Trial 1/20
2025-11-21 10:56:30 - INFO - ----------------------------------------
2025-11-21 10:56:30 - INFO - Architecture: {'num_stages': 4, 'blocks_per_stage': 2, 'filters_per_stage': [64, 128, 256, 512], 'mul_map_files': ['./multipliers/mul8u_1JJQ.bin', './multipliers/mul8u_LK8.bin', './multipliers/mul8u_1JJQ.bin', './multipliers/mul8u_1JJQ.bin']}
2025-11-21 11:13:35 - INFO - ----------------------------------------
2025-11-21 11:13:35 - INFO - Trial 1/20
2025-11-21 11:13:35 - INFO - ----------------------------------------
2025-11-21 11:13:35 - INFO - Architecture: {'num_stages': 4, 'blocks_per_stage': 2, 'filters_per_stage': [64, 128, 256, 512], 'mul_map_files': ['./multipliers/mul8u_1JJQ.bin', './multipliers/mul8u_LK8.bin', './multipliers/mul8u_1JJQ.bin', './multipliers/mul8u_1JJQ.bin']}
2025-11-21 11:13:35 - INFO - Exact accuracy: 0.9247
2025-11-21 11:13:35 - INFO - Approx accuracy: 0.9235
2025-11-21 11:13:35 - INFO - Accuracy drop: 0.0012
2025-11-21 11:13:35 - INFO - Total energy: 1107.3036 µJ
2025-11-21 11:13:35 - INFO - STL robustness: 0.0335 (SATISFIED)
2025-11-21 11:13:35 - INFO - Energy breakdown per stage:
2025-11-21 11:13:35 - INFO -   Stage 0: mul8u_1JJQ.bin - 65.4589 µJ (115,015,680 MACs)
2025-11-21 11:13:35 - INFO -   Stage 1: mul8u_LK8.bin - 139.5193 µJ (264,241,152 MACs)
2025-11-21 11:13:35 - INFO -   Stage 2: mul8u_1JJQ.bin - 300.7751 µJ (528,482,304 MACs)
2025-11-21 11:13:35 - INFO -   Stage 3: mul8u_1JJQ.bin - 601.5503 µJ (1,056,964,608 MACs)
2025-11-21 11:13:36 - INFO - Training curves saved for trial 1
2025-11-21 11:13:36 - INFO - Energy breakdown plot saved for trial 1
2025-11-21 11:13:36 - INFO - ----------------------------------------
2025-11-21 11:13:36 - INFO - Trial 2/20
2025-11-21 11:13:36 - INFO - ----------------------------------------
2025-11-21 11:13:36 - INFO - Architecture: {'num_stages': 4, 'blocks_per_stage': 2, 'filters_per_stage': [64, 128, 256, 512], 'mul_map_files': ['./multipliers/mul8u_LK8.bin', './multipliers/mul8u_1JJQ.bin', './multipliers/mul8u_LK8.bin', './multipliers/mul8u_1JJQ.bin']}
2025-11-21 11:30:41 - INFO - ----------------------------------------
2025-11-21 11:30:41 - INFO - Trial 2/20
2025-11-21 11:30:41 - INFO - ----------------------------------------
2025-11-21 11:30:41 - INFO - Architecture: {'num_stages': 4, 'blocks_per_stage': 2, 'filters_per_stage': [64, 128, 256, 512], 'mul_map_files': ['./multipliers/mul8u_LK8.bin', './multipliers/mul8u_1JJQ.bin', './multipliers/mul8u_LK8.bin', './multipliers/mul8u_1JJQ.bin']}
2025-11-21 11:30:41 - INFO - Exact accuracy: 0.9260
2025-11-21 11:30:41 - INFO - Approx accuracy: 0.9288
2025-11-21 11:30:41 - INFO - Accuracy drop: -0.0028
2025-11-21 11:30:41 - INFO - Total energy: 1091.7048 µJ
2025-11-21 11:30:41 - INFO - STL robustness: 0.0388 (SATISFIED)
2025-11-21 11:30:41 - INFO - Energy breakdown per stage:
2025-11-21 11:30:41 - INFO -   Stage 0: mul8u_LK8.bin - 60.7283 µJ (115,015,680 MACs)
2025-11-21 11:30:41 - INFO -   Stage 1: mul8u_1JJQ.bin - 150.3876 µJ (264,241,152 MACs)
2025-11-21 11:30:41 - INFO -   Stage 2: mul8u_LK8.bin - 279.0387 µJ (528,482,304 MACs)
2025-11-21 11:30:41 - INFO -   Stage 3: mul8u_1JJQ.bin - 601.5503 µJ (1,056,964,608 MACs)
2025-11-21 11:30:41 - INFO - Training curves saved for trial 2
2025-11-21 11:30:42 - INFO - Energy breakdown plot saved for trial 2
2025-11-21 11:30:42 - INFO - ----------------------------------------
2025-11-21 11:30:42 - INFO - Trial 3/20
2025-11-21 11:30:42 - INFO - ----------------------------------------
2025-11-21 11:30:42 - INFO - Architecture: {'num_stages': 4, 'blocks_per_stage': 2, 'filters_per_stage': [64, 128, 256, 512], 'mul_map_files': ['./multipliers/mul8u_LK8.bin', './multipliers/mul8u_1JJQ.bin', './multipliers/mul8u_1JJQ.bin', './multipliers/mul8u_LK8.bin']}
2025-11-21 11:47:48 - INFO - ----------------------------------------
2025-11-21 11:47:48 - INFO - Trial 3/20
2025-11-21 11:47:48 - INFO - ----------------------------------------
2025-11-21 11:47:48 - INFO - Architecture: {'num_stages': 4, 'blocks_per_stage': 2, 'filters_per_stage': [64, 128, 256, 512], 'mul_map_files': ['./multipliers/mul8u_LK8.bin', './multipliers/mul8u_1JJQ.bin', './multipliers/mul8u_1JJQ.bin', './multipliers/mul8u_LK8.bin']}
2025-11-21 11:47:48 - INFO - Exact accuracy: 0.9244
2025-11-21 11:47:48 - INFO - Approx accuracy: 0.9259
2025-11-21 11:47:48 - INFO - Accuracy drop: -0.0015
2025-11-21 11:47:48 - INFO - Total energy: 1069.9683 µJ
2025-11-21 11:47:48 - INFO - STL robustness: 0.0359 (SATISFIED)
2025-11-21 11:47:48 - INFO - Energy breakdown per stage:
2025-11-21 11:47:48 - INFO -   Stage 0: mul8u_LK8.bin - 60.7283 µJ (115,015,680 MACs)
2025-11-21 11:47:48 - INFO -   Stage 1: mul8u_1JJQ.bin - 150.3876 µJ (264,241,152 MACs)
2025-11-21 11:47:48 - INFO -   Stage 2: mul8u_1JJQ.bin - 300.7751 µJ (528,482,304 MACs)
2025-11-21 11:47:48 - INFO -   Stage 3: mul8u_LK8.bin - 558.0773 µJ (1,056,964,608 MACs)
2025-11-21 11:47:48 - INFO - Training curves saved for trial 3
2025-11-21 11:47:49 - INFO - Energy breakdown plot saved for trial 3
2025-11-21 11:47:49 - INFO - ----------------------------------------
2025-11-21 11:47:49 - INFO - Trial 4/20
2025-11-21 11:47:49 - INFO - ----------------------------------------
2025-11-21 11:47:49 - INFO - Architecture: {'num_stages': 4, 'blocks_per_stage': 2, 'filters_per_stage': [64, 128, 256, 512], 'mul_map_files': ['./multipliers/mul8u_LK8.bin', './multipliers/mul8u_LK8.bin', './multipliers/mul8u_1JJQ.bin', './multipliers/mul8u_LK8.bin']}
2025-11-21 12:04:56 - INFO - ----------------------------------------
2025-11-21 12:04:56 - INFO - Trial 4/20
2025-11-21 12:04:56 - INFO - ----------------------------------------
2025-11-21 12:04:56 - INFO - Architecture: {'num_stages': 4, 'blocks_per_stage': 2, 'filters_per_stage': [64, 128, 256, 512], 'mul_map_files': ['./multipliers/mul8u_LK8.bin', './multipliers/mul8u_LK8.bin', './multipliers/mul8u_1JJQ.bin', './multipliers/mul8u_LK8.bin']}
2025-11-21 12:04:56 - INFO - Exact accuracy: 0.9253
2025-11-21 12:04:56 - INFO - Approx accuracy: 0.9254
2025-11-21 12:04:56 - INFO - Accuracy drop: -0.0001
2025-11-21 12:04:56 - INFO - Total energy: 1059.1001 µJ
2025-11-21 12:04:56 - INFO - STL robustness: 0.0354 (SATISFIED)
2025-11-21 12:04:56 - INFO - Energy breakdown per stage:
2025-11-21 12:04:56 - INFO -   Stage 0: mul8u_LK8.bin - 60.7283 µJ (115,015,680 MACs)
2025-11-21 12:04:56 - INFO -   Stage 1: mul8u_LK8.bin - 139.5193 µJ (264,241,152 MACs)
2025-11-21 12:04:56 - INFO -   Stage 2: mul8u_1JJQ.bin - 300.7751 µJ (528,482,304 MACs)
2025-11-21 12:04:56 - INFO -   Stage 3: mul8u_LK8.bin - 558.0773 µJ (1,056,964,608 MACs)
2025-11-21 12:04:56 - INFO - Training curves saved for trial 4
2025-11-21 12:04:56 - INFO - Energy breakdown plot saved for trial 4
2025-11-21 12:04:56 - INFO - ----------------------------------------
2025-11-21 12:04:56 - INFO - Trial 5/20
2025-11-21 12:04:56 - INFO - ----------------------------------------
2025-11-21 12:04:56 - INFO - Architecture: {'num_stages': 4, 'blocks_per_stage': 2, 'filters_per_stage': [64, 128, 256, 512], 'mul_map_files': ['./multipliers/mul8u_LK8.bin', './multipliers/mul8u_LK8.bin', './multipliers/mul8u_LK8.bin', './multipliers/mul8u_1JJQ.bin']}
2025-11-21 12:22:03 - INFO - ----------------------------------------
2025-11-21 12:22:03 - INFO - Trial 5/20
2025-11-21 12:22:03 - INFO - ----------------------------------------
2025-11-21 12:22:03 - INFO - Architecture: {'num_stages': 4, 'blocks_per_stage': 2, 'filters_per_stage': [64, 128, 256, 512], 'mul_map_files': ['./multipliers/mul8u_LK8.bin', './multipliers/mul8u_LK8.bin', './multipliers/mul8u_LK8.bin', './multipliers/mul8u_1JJQ.bin']}
2025-11-21 12:22:03 - INFO - Exact accuracy: 0.9257
2025-11-21 12:22:03 - INFO - Approx accuracy: 0.9278
2025-11-21 12:22:03 - INFO - Accuracy drop: -0.0021
2025-11-21 12:22:03 - INFO - Total energy: 1080.8365 µJ
2025-11-21 12:22:03 - INFO - STL robustness: 0.0378 (SATISFIED)
2025-11-21 12:22:03 - INFO - Energy breakdown per stage:
2025-11-21 12:22:03 - INFO -   Stage 0: mul8u_LK8.bin - 60.7283 µJ (115,015,680 MACs)
2025-11-21 12:22:03 - INFO -   Stage 1: mul8u_LK8.bin - 139.5193 µJ (264,241,152 MACs)
2025-11-21 12:22:03 - INFO -   Stage 2: mul8u_LK8.bin - 279.0387 µJ (528,482,304 MACs)
2025-11-21 12:22:03 - INFO -   Stage 3: mul8u_1JJQ.bin - 601.5503 µJ (1,056,964,608 MACs)
2025-11-21 12:22:04 - INFO - Training curves saved for trial 5
2025-11-21 12:22:04 - INFO - Energy breakdown plot saved for trial 5
2025-11-21 12:22:04 - INFO - ----------------------------------------
2025-11-21 12:22:04 - INFO - Trial 6/20
2025-11-21 12:22:04 - INFO - ----------------------------------------
2025-11-21 12:22:04 - INFO - Architecture: {'num_stages': 4, 'blocks_per_stage': 2, 'filters_per_stage': [64, 128, 256, 512], 'mul_map_files': ['./multipliers/mul8u_1JJQ.bin', './multipliers/mul8u_LK8.bin', './multipliers/mul8u_LK8.bin', './multipliers/mul8u_1JJQ.bin']}
2025-11-21 12:39:13 - INFO - ----------------------------------------
2025-11-21 12:39:13 - INFO - Trial 6/20
2025-11-21 12:39:13 - INFO - ----------------------------------------
2025-11-21 12:39:13 - INFO - Architecture: {'num_stages': 4, 'blocks_per_stage': 2, 'filters_per_stage': [64, 128, 256, 512], 'mul_map_files': ['./multipliers/mul8u_1JJQ.bin', './multipliers/mul8u_LK8.bin', './multipliers/mul8u_LK8.bin', './multipliers/mul8u_1JJQ.bin']}
2025-11-21 12:39:13 - INFO - Exact accuracy: 0.9267
2025-11-21 12:39:13 - INFO - Approx accuracy: 0.9263
2025-11-21 12:39:13 - INFO - Accuracy drop: 0.0004
2025-11-21 12:39:13 - INFO - Total energy: 1085.5671 µJ
2025-11-21 12:39:13 - INFO - STL robustness: 0.0363 (SATISFIED)
2025-11-21 12:39:13 - INFO - Energy breakdown per stage:
2025-11-21 12:39:13 - INFO -   Stage 0: mul8u_1JJQ.bin - 65.4589 µJ (115,015,680 MACs)
2025-11-21 12:39:13 - INFO -   Stage 1: mul8u_LK8.bin - 139.5193 µJ (264,241,152 MACs)
2025-11-21 12:39:13 - INFO -   Stage 2: mul8u_LK8.bin - 279.0387 µJ (528,482,304 MACs)
2025-11-21 12:39:13 - INFO -   Stage 3: mul8u_1JJQ.bin - 601.5503 µJ (1,056,964,608 MACs)
2025-11-21 12:39:13 - INFO - Training curves saved for trial 6
2025-11-21 12:39:13 - INFO - Energy breakdown plot saved for trial 6
2025-11-21 12:39:13 - INFO - ----------------------------------------
2025-11-21 12:39:13 - INFO - Trial 7/20
2025-11-21 12:39:13 - INFO - ----------------------------------------
2025-11-21 12:39:13 - INFO - Architecture: {'num_stages': 4, 'blocks_per_stage': 2, 'filters_per_stage': [64, 128, 256, 512], 'mul_map_files': ['./multipliers/mul8u_1JJQ.bin', './multipliers/mul8u_LK8.bin', './multipliers/mul8u_1JJQ.bin', './multipliers/mul8u_1JJQ.bin']}
2025-11-21 12:56:20 - INFO - ----------------------------------------
2025-11-21 12:56:20 - INFO - Trial 7/20
2025-11-21 12:56:20 - INFO - ----------------------------------------
2025-11-21 12:56:20 - INFO - Architecture: {'num_stages': 4, 'blocks_per_stage': 2, 'filters_per_stage': [64, 128, 256, 512], 'mul_map_files': ['./multipliers/mul8u_1JJQ.bin', './multipliers/mul8u_LK8.bin', './multipliers/mul8u_1JJQ.bin', './multipliers/mul8u_1JJQ.bin']}
2025-11-21 12:56:20 - INFO - Exact accuracy: 0.9232
2025-11-21 12:56:20 - INFO - Approx accuracy: 0.9228
2025-11-21 12:56:20 - INFO - Accuracy drop: 0.0004
2025-11-21 12:56:20 - INFO - Total energy: 1107.3036 µJ
2025-11-21 12:56:20 - INFO - STL robustness: 0.0328 (SATISFIED)
2025-11-21 12:56:20 - INFO - Energy breakdown per stage:
2025-11-21 12:56:20 - INFO -   Stage 0: mul8u_1JJQ.bin - 65.4589 µJ (115,015,680 MACs)
2025-11-21 12:56:20 - INFO -   Stage 1: mul8u_LK8.bin - 139.5193 µJ (264,241,152 MACs)
2025-11-21 12:56:20 - INFO -   Stage 2: mul8u_1JJQ.bin - 300.7751 µJ (528,482,304 MACs)
2025-11-21 12:56:20 - INFO -   Stage 3: mul8u_1JJQ.bin - 601.5503 µJ (1,056,964,608 MACs)
2025-11-21 12:56:20 - INFO - Training curves saved for trial 7
2025-11-21 12:56:20 - INFO - Energy breakdown plot saved for trial 7
2025-11-21 12:56:20 - INFO - ----------------------------------------
2025-11-21 12:56:20 - INFO - Trial 8/20
2025-11-21 12:56:20 - INFO - ----------------------------------------
2025-11-21 12:56:20 - INFO - Architecture: {'num_stages': 4, 'blocks_per_stage': 2, 'filters_per_stage': [64, 128, 256, 512], 'mul_map_files': ['./multipliers/mul8u_LK8.bin', './multipliers/mul8u_1JJQ.bin', './multipliers/mul8u_1JJQ.bin', './multipliers/mul8u_LK8.bin']}
2025-11-21 13:13:30 - INFO - ----------------------------------------
2025-11-21 13:13:30 - INFO - Trial 8/20
2025-11-21 13:13:30 - INFO - ----------------------------------------
2025-11-21 13:13:30 - INFO - Architecture: {'num_stages': 4, 'blocks_per_stage': 2, 'filters_per_stage': [64, 128, 256, 512], 'mul_map_files': ['./multipliers/mul8u_LK8.bin', './multipliers/mul8u_1JJQ.bin', './multipliers/mul8u_1JJQ.bin', './multipliers/mul8u_LK8.bin']}
2025-11-21 13:13:30 - INFO - Exact accuracy: 0.9271
2025-11-21 13:13:30 - INFO - Approx accuracy: 0.9281
2025-11-21 13:13:30 - INFO - Accuracy drop: -0.0010
2025-11-21 13:13:30 - INFO - Total energy: 1069.9683 µJ
2025-11-21 13:13:30 - INFO - STL robustness: 0.0381 (SATISFIED)
2025-11-21 13:13:30 - INFO - Energy breakdown per stage:
2025-11-21 13:13:30 - INFO -   Stage 0: mul8u_LK8.bin - 60.7283 µJ (115,015,680 MACs)
2025-11-21 13:13:30 - INFO -   Stage 1: mul8u_1JJQ.bin - 150.3876 µJ (264,241,152 MACs)
2025-11-21 13:13:30 - INFO -   Stage 2: mul8u_1JJQ.bin - 300.7751 µJ (528,482,304 MACs)
2025-11-21 13:13:30 - INFO -   Stage 3: mul8u_LK8.bin - 558.0773 µJ (1,056,964,608 MACs)
2025-11-21 13:13:30 - INFO - Training curves saved for trial 8
2025-11-21 13:13:31 - INFO - Energy breakdown plot saved for trial 8
2025-11-21 13:13:31 - INFO - ----------------------------------------
2025-11-21 13:13:31 - INFO - Trial 9/20
2025-11-21 13:13:31 - INFO - ----------------------------------------
2025-11-21 13:13:31 - INFO - Architecture: {'num_stages': 4, 'blocks_per_stage': 2, 'filters_per_stage': [64, 128, 256, 512], 'mul_map_files': ['./multipliers/mul8u_1JJQ.bin', './multipliers/mul8u_1JJQ.bin', './multipliers/mul8u_1JJQ.bin', './multipliers/mul8u_LK8.bin']}
2025-11-21 13:30:33 - INFO - ----------------------------------------
2025-11-21 13:30:33 - INFO - Trial 9/20
2025-11-21 13:30:33 - INFO - ----------------------------------------
2025-11-21 13:30:33 - INFO - Architecture: {'num_stages': 4, 'blocks_per_stage': 2, 'filters_per_stage': [64, 128, 256, 512], 'mul_map_files': ['./multipliers/mul8u_1JJQ.bin', './multipliers/mul8u_1JJQ.bin', './multipliers/mul8u_1JJQ.bin', './multipliers/mul8u_LK8.bin']}
2025-11-21 13:30:33 - INFO - Exact accuracy: 0.9289
2025-11-21 13:30:33 - INFO - Approx accuracy: 0.9294
2025-11-21 13:30:33 - INFO - Accuracy drop: -0.0005
2025-11-21 13:30:33 - INFO - Total energy: 1074.6989 µJ
2025-11-21 13:30:33 - INFO - STL robustness: 0.0394 (SATISFIED)
2025-11-21 13:30:33 - INFO - Energy breakdown per stage:
2025-11-21 13:30:33 - INFO -   Stage 0: mul8u_1JJQ.bin - 65.4589 µJ (115,015,680 MACs)
2025-11-21 13:30:33 - INFO -   Stage 1: mul8u_1JJQ.bin - 150.3876 µJ (264,241,152 MACs)
2025-11-21 13:30:33 - INFO -   Stage 2: mul8u_1JJQ.bin - 300.7751 µJ (528,482,304 MACs)
2025-11-21 13:30:33 - INFO -   Stage 3: mul8u_LK8.bin - 558.0773 µJ (1,056,964,608 MACs)
2025-11-21 13:30:34 - INFO - Training curves saved for trial 9
2025-11-21 13:30:34 - INFO - Energy breakdown plot saved for trial 9
2025-11-21 13:30:34 - INFO - ----------------------------------------
2025-11-21 13:30:34 - INFO - Trial 10/20
2025-11-21 13:30:34 - INFO - ----------------------------------------
2025-11-21 13:30:34 - INFO - Architecture: {'num_stages': 4, 'blocks_per_stage': 2, 'filters_per_stage': [64, 128, 256, 512], 'mul_map_files': ['./multipliers/mul8u_LK8.bin', './multipliers/mul8u_1JJQ.bin', './multipliers/mul8u_1JJQ.bin', './multipliers/mul8u_LK8.bin']}
2025-11-21 13:47:32 - INFO - ----------------------------------------
2025-11-21 13:47:32 - INFO - Trial 10/20
2025-11-21 13:47:32 - INFO - ----------------------------------------
2025-11-21 13:47:32 - INFO - Architecture: {'num_stages': 4, 'blocks_per_stage': 2, 'filters_per_stage': [64, 128, 256, 512], 'mul_map_files': ['./multipliers/mul8u_LK8.bin', './multipliers/mul8u_1JJQ.bin', './multipliers/mul8u_1JJQ.bin', './multipliers/mul8u_LK8.bin']}
2025-11-21 13:47:32 - INFO - Exact accuracy: 0.9215
2025-11-21 13:47:32 - INFO - Approx accuracy: 0.9230
2025-11-21 13:47:32 - INFO - Accuracy drop: -0.0015
2025-11-21 13:47:32 - INFO - Total energy: 1069.9683 µJ
2025-11-21 13:47:32 - INFO - STL robustness: 0.0330 (SATISFIED)
2025-11-21 13:47:32 - INFO - Energy breakdown per stage:
2025-11-21 13:47:32 - INFO -   Stage 0: mul8u_LK8.bin - 60.7283 µJ (115,015,680 MACs)
2025-11-21 13:47:32 - INFO -   Stage 1: mul8u_1JJQ.bin - 150.3876 µJ (264,241,152 MACs)
2025-11-21 13:47:32 - INFO -   Stage 2: mul8u_1JJQ.bin - 300.7751 µJ (528,482,304 MACs)
2025-11-21 13:47:32 - INFO -   Stage 3: mul8u_LK8.bin - 558.0773 µJ (1,056,964,608 MACs)
2025-11-21 13:47:33 - INFO - Training curves saved for trial 10
2025-11-21 13:47:33 - INFO - Energy breakdown plot saved for trial 10
2025-11-21 13:47:33 - INFO - ----------------------------------------
2025-11-21 13:47:33 - INFO - Trial 11/20
2025-11-21 13:47:33 - INFO - ----------------------------------------
2025-11-21 13:47:33 - INFO - Architecture: {'num_stages': 4, 'blocks_per_stage': 2, 'filters_per_stage': [64, 128, 256, 512], 'mul_map_files': ['./multipliers/mul8u_1JJQ.bin', './multipliers/mul8u_LK8.bin', './multipliers/mul8u_LK8.bin', './multipliers/mul8u_LK8.bin']}
2025-11-21 14:04:35 - INFO - ----------------------------------------
2025-11-21 14:04:35 - INFO - Trial 11/20
2025-11-21 14:04:35 - INFO - ----------------------------------------
2025-11-21 14:04:35 - INFO - Architecture: {'num_stages': 4, 'blocks_per_stage': 2, 'filters_per_stage': [64, 128, 256, 512], 'mul_map_files': ['./multipliers/mul8u_1JJQ.bin', './multipliers/mul8u_LK8.bin', './multipliers/mul8u_LK8.bin', './multipliers/mul8u_LK8.bin']}
2025-11-21 14:04:35 - INFO - Exact accuracy: 0.9248
2025-11-21 14:04:35 - INFO - Approx accuracy: 0.9248
2025-11-21 14:04:35 - INFO - Accuracy drop: 0.0000
2025-11-21 14:04:35 - INFO - Total energy: 1042.0942 µJ
2025-11-21 14:04:35 - INFO - STL robustness: 0.0348 (SATISFIED)
2025-11-21 14:04:35 - INFO - Energy breakdown per stage:
2025-11-21 14:04:35 - INFO -   Stage 0: mul8u_1JJQ.bin - 65.4589 µJ (115,015,680 MACs)
2025-11-21 14:04:35 - INFO -   Stage 1: mul8u_LK8.bin - 139.5193 µJ (264,241,152 MACs)
2025-11-21 14:04:35 - INFO -   Stage 2: mul8u_LK8.bin - 279.0387 µJ (528,482,304 MACs)
2025-11-21 14:04:35 - INFO -   Stage 3: mul8u_LK8.bin - 558.0773 µJ (1,056,964,608 MACs)
2025-11-21 14:04:36 - INFO - Training curves saved for trial 11
2025-11-21 14:04:36 - INFO - Energy breakdown plot saved for trial 11
2025-11-21 14:04:36 - INFO - ----------------------------------------
2025-11-21 14:04:36 - INFO - Trial 12/20
2025-11-21 14:04:36 - INFO - ----------------------------------------
2025-11-21 14:04:36 - INFO - Architecture: {'num_stages': 4, 'blocks_per_stage': 2, 'filters_per_stage': [64, 128, 256, 512], 'mul_map_files': ['./multipliers/mul8u_LK8.bin', './multipliers/mul8u_LK8.bin', './multipliers/mul8u_1JJQ.bin', './multipliers/mul8u_1JJQ.bin']}
2025-11-21 14:21:48 - INFO - ----------------------------------------
2025-11-21 14:21:48 - INFO - Trial 12/20
2025-11-21 14:21:48 - INFO - ----------------------------------------
2025-11-21 14:21:48 - INFO - Architecture: {'num_stages': 4, 'blocks_per_stage': 2, 'filters_per_stage': [64, 128, 256, 512], 'mul_map_files': ['./multipliers/mul8u_LK8.bin', './multipliers/mul8u_LK8.bin', './multipliers/mul8u_1JJQ.bin', './multipliers/mul8u_1JJQ.bin']}
2025-11-21 14:21:48 - INFO - Exact accuracy: 0.9232
2025-11-21 14:21:48 - INFO - Approx accuracy: 0.9233
2025-11-21 14:21:48 - INFO - Accuracy drop: -0.0001
2025-11-21 14:21:48 - INFO - Total energy: 1102.5730 µJ
2025-11-21 14:21:48 - INFO - STL robustness: 0.0333 (SATISFIED)
2025-11-21 14:21:48 - INFO - Energy breakdown per stage:
2025-11-21 14:21:48 - INFO -   Stage 0: mul8u_LK8.bin - 60.7283 µJ (115,015,680 MACs)
2025-11-21 14:21:48 - INFO -   Stage 1: mul8u_LK8.bin - 139.5193 µJ (264,241,152 MACs)
2025-11-21 14:21:48 - INFO -   Stage 2: mul8u_1JJQ.bin - 300.7751 µJ (528,482,304 MACs)
2025-11-21 14:21:48 - INFO -   Stage 3: mul8u_1JJQ.bin - 601.5503 µJ (1,056,964,608 MACs)
2025-11-21 14:21:48 - INFO - Training curves saved for trial 12
2025-11-21 14:21:49 - INFO - Energy breakdown plot saved for trial 12
2025-11-21 14:21:49 - INFO - ----------------------------------------
2025-11-21 14:21:49 - INFO - Trial 13/20
2025-11-21 14:21:49 - INFO - ----------------------------------------
2025-11-21 14:21:49 - INFO - Architecture: {'num_stages': 4, 'blocks_per_stage': 2, 'filters_per_stage': [64, 128, 256, 512], 'mul_map_files': ['./multipliers/mul8u_1JJQ.bin', './multipliers/mul8u_1JJQ.bin', './multipliers/mul8u_LK8.bin', './multipliers/mul8u_LK8.bin']}
2025-11-21 14:38:58 - INFO - ----------------------------------------
2025-11-21 14:38:58 - INFO - Trial 13/20
2025-11-21 14:38:58 - INFO - ----------------------------------------
2025-11-21 14:38:58 - INFO - Architecture: {'num_stages': 4, 'blocks_per_stage': 2, 'filters_per_stage': [64, 128, 256, 512], 'mul_map_files': ['./multipliers/mul8u_1JJQ.bin', './multipliers/mul8u_1JJQ.bin', './multipliers/mul8u_LK8.bin', './multipliers/mul8u_LK8.bin']}
2025-11-21 14:38:58 - INFO - Exact accuracy: 0.9212
2025-11-21 14:38:58 - INFO - Approx accuracy: 0.9209
2025-11-21 14:38:58 - INFO - Accuracy drop: 0.0003
2025-11-21 14:38:58 - INFO - Total energy: 1052.9624 µJ
2025-11-21 14:38:58 - INFO - STL robustness: 0.0309 (SATISFIED)
2025-11-21 14:38:58 - INFO - Energy breakdown per stage:
2025-11-21 14:38:58 - INFO -   Stage 0: mul8u_1JJQ.bin - 65.4589 µJ (115,015,680 MACs)
2025-11-21 14:38:58 - INFO -   Stage 1: mul8u_1JJQ.bin - 150.3876 µJ (264,241,152 MACs)
2025-11-21 14:38:58 - INFO -   Stage 2: mul8u_LK8.bin - 279.0387 µJ (528,482,304 MACs)
2025-11-21 14:38:58 - INFO -   Stage 3: mul8u_LK8.bin - 558.0773 µJ (1,056,964,608 MACs)
2025-11-21 14:38:58 - INFO - Training curves saved for trial 13
2025-11-21 14:38:58 - INFO - Energy breakdown plot saved for trial 13
2025-11-21 14:38:58 - INFO - ----------------------------------------
2025-11-21 14:38:58 - INFO - Trial 14/20
2025-11-21 14:38:58 - INFO - ----------------------------------------
2025-11-21 14:38:58 - INFO - Architecture: {'num_stages': 4, 'blocks_per_stage': 2, 'filters_per_stage': [64, 128, 256, 512], 'mul_map_files': ['./multipliers/mul8u_LK8.bin', './multipliers/mul8u_1JJQ.bin', './multipliers/mul8u_LK8.bin', './multipliers/mul8u_LK8.bin']}
2025-11-21 14:56:11 - INFO - ----------------------------------------
2025-11-21 14:56:11 - INFO - Trial 14/20
2025-11-21 14:56:11 - INFO - ----------------------------------------
2025-11-21 14:56:11 - INFO - Architecture: {'num_stages': 4, 'blocks_per_stage': 2, 'filters_per_stage': [64, 128, 256, 512], 'mul_map_files': ['./multipliers/mul8u_LK8.bin', './multipliers/mul8u_1JJQ.bin', './multipliers/mul8u_LK8.bin', './multipliers/mul8u_LK8.bin']}
2025-11-21 14:56:11 - INFO - Exact accuracy: 0.9258
2025-11-21 14:56:11 - INFO - Approx accuracy: 0.9269
2025-11-21 14:56:11 - INFO - Accuracy drop: -0.0011
2025-11-21 14:56:11 - INFO - Total energy: 1048.2318 µJ
2025-11-21 14:56:11 - INFO - STL robustness: 0.0369 (SATISFIED)
2025-11-21 14:56:11 - INFO - Energy breakdown per stage:
2025-11-21 14:56:11 - INFO -   Stage 0: mul8u_LK8.bin - 60.7283 µJ (115,015,680 MACs)
2025-11-21 14:56:11 - INFO -   Stage 1: mul8u_1JJQ.bin - 150.3876 µJ (264,241,152 MACs)
2025-11-21 14:56:11 - INFO -   Stage 2: mul8u_LK8.bin - 279.0387 µJ (528,482,304 MACs)
2025-11-21 14:56:11 - INFO -   Stage 3: mul8u_LK8.bin - 558.0773 µJ (1,056,964,608 MACs)
2025-11-21 14:56:11 - INFO - Training curves saved for trial 14
2025-11-21 14:56:11 - INFO - Energy breakdown plot saved for trial 14
2025-11-21 14:56:11 - INFO - ----------------------------------------
2025-11-21 14:56:11 - INFO - Trial 15/20
2025-11-21 14:56:11 - INFO - ----------------------------------------
2025-11-21 14:56:11 - INFO - Architecture: {'num_stages': 4, 'blocks_per_stage': 2, 'filters_per_stage': [64, 128, 256, 512], 'mul_map_files': ['./multipliers/mul8u_LK8.bin', './multipliers/mul8u_LK8.bin', './multipliers/mul8u_1JJQ.bin', './multipliers/mul8u_LK8.bin']}
2025-11-21 15:13:22 - INFO - ----------------------------------------
2025-11-21 15:13:22 - INFO - Trial 15/20
2025-11-21 15:13:22 - INFO - ----------------------------------------
2025-11-21 15:13:22 - INFO - Architecture: {'num_stages': 4, 'blocks_per_stage': 2, 'filters_per_stage': [64, 128, 256, 512], 'mul_map_files': ['./multipliers/mul8u_LK8.bin', './multipliers/mul8u_LK8.bin', './multipliers/mul8u_1JJQ.bin', './multipliers/mul8u_LK8.bin']}
2025-11-21 15:13:22 - INFO - Exact accuracy: 0.9269
2025-11-21 15:13:22 - INFO - Approx accuracy: 0.9286
2025-11-21 15:13:22 - INFO - Accuracy drop: -0.0017
2025-11-21 15:13:22 - INFO - Total energy: 1059.1001 µJ
2025-11-21 15:13:22 - INFO - STL robustness: 0.0386 (SATISFIED)
2025-11-21 15:13:22 - INFO - Energy breakdown per stage:
2025-11-21 15:13:22 - INFO -   Stage 0: mul8u_LK8.bin - 60.7283 µJ (115,015,680 MACs)
2025-11-21 15:13:22 - INFO -   Stage 1: mul8u_LK8.bin - 139.5193 µJ (264,241,152 MACs)
2025-11-21 15:13:22 - INFO -   Stage 2: mul8u_1JJQ.bin - 300.7751 µJ (528,482,304 MACs)
2025-11-21 15:13:22 - INFO -   Stage 3: mul8u_LK8.bin - 558.0773 µJ (1,056,964,608 MACs)
2025-11-21 15:13:23 - INFO - Training curves saved for trial 15
2025-11-21 15:13:23 - INFO - Energy breakdown plot saved for trial 15
2025-11-21 15:13:23 - INFO - ----------------------------------------
2025-11-21 15:13:23 - INFO - Trial 16/20
2025-11-21 15:13:23 - INFO - ----------------------------------------
2025-11-21 15:13:23 - INFO - Architecture: {'num_stages': 4, 'blocks_per_stage': 2, 'filters_per_stage': [64, 128, 256, 512], 'mul_map_files': ['./multipliers/mul8u_1JJQ.bin', './multipliers/mul8u_LK8.bin', './multipliers/mul8u_LK8.bin', './multipliers/mul8u_1JJQ.bin']}
2025-11-21 15:30:35 - INFO - ----------------------------------------
2025-11-21 15:30:35 - INFO - Trial 16/20
2025-11-21 15:30:35 - INFO - ----------------------------------------
2025-11-21 15:30:35 - INFO - Architecture: {'num_stages': 4, 'blocks_per_stage': 2, 'filters_per_stage': [64, 128, 256, 512], 'mul_map_files': ['./multipliers/mul8u_1JJQ.bin', './multipliers/mul8u_LK8.bin', './multipliers/mul8u_LK8.bin', './multipliers/mul8u_1JJQ.bin']}
2025-11-21 15:30:35 - INFO - Exact accuracy: 0.9290
2025-11-21 15:30:35 - INFO - Approx accuracy: 0.9290
2025-11-21 15:30:35 - INFO - Accuracy drop: 0.0000
2025-11-21 15:30:35 - INFO - Total energy: 1085.5671 µJ
2025-11-21 15:30:35 - INFO - STL robustness: 0.0390 (SATISFIED)
2025-11-21 15:30:35 - INFO - Energy breakdown per stage:
2025-11-21 15:30:35 - INFO -   Stage 0: mul8u_1JJQ.bin - 65.4589 µJ (115,015,680 MACs)
2025-11-21 15:30:35 - INFO -   Stage 1: mul8u_LK8.bin - 139.5193 µJ (264,241,152 MACs)
2025-11-21 15:30:35 - INFO -   Stage 2: mul8u_LK8.bin - 279.0387 µJ (528,482,304 MACs)
2025-11-21 15:30:35 - INFO -   Stage 3: mul8u_1JJQ.bin - 601.5503 µJ (1,056,964,608 MACs)
2025-11-21 15:30:35 - INFO - Training curves saved for trial 16
2025-11-21 15:30:35 - INFO - Energy breakdown plot saved for trial 16
2025-11-21 15:30:35 - INFO - ----------------------------------------
2025-11-21 15:30:35 - INFO - Trial 17/20
2025-11-21 15:30:35 - INFO - ----------------------------------------
2025-11-21 15:30:35 - INFO - Architecture: {'num_stages': 4, 'blocks_per_stage': 2, 'filters_per_stage': [64, 128, 256, 512], 'mul_map_files': ['./multipliers/mul8u_LK8.bin', './multipliers/mul8u_LK8.bin', './multipliers/mul8u_LK8.bin', './multipliers/mul8u_1JJQ.bin']}
2025-11-21 15:47:44 - INFO - ----------------------------------------
2025-11-21 15:47:44 - INFO - Trial 17/20
2025-11-21 15:47:44 - INFO - ----------------------------------------
2025-11-21 15:47:44 - INFO - Architecture: {'num_stages': 4, 'blocks_per_stage': 2, 'filters_per_stage': [64, 128, 256, 512], 'mul_map_files': ['./multipliers/mul8u_LK8.bin', './multipliers/mul8u_LK8.bin', './multipliers/mul8u_LK8.bin', './multipliers/mul8u_1JJQ.bin']}
2025-11-21 15:47:44 - INFO - Exact accuracy: 0.9232
2025-11-21 15:47:44 - INFO - Approx accuracy: 0.9238
2025-11-21 15:47:44 - INFO - Accuracy drop: -0.0006
2025-11-21 15:47:44 - INFO - Total energy: 1080.8365 µJ
2025-11-21 15:47:44 - INFO - STL robustness: 0.0338 (SATISFIED)
2025-11-21 15:47:44 - INFO - Energy breakdown per stage:
2025-11-21 15:47:44 - INFO -   Stage 0: mul8u_LK8.bin - 60.7283 µJ (115,015,680 MACs)
2025-11-21 15:47:44 - INFO -   Stage 1: mul8u_LK8.bin - 139.5193 µJ (264,241,152 MACs)
2025-11-21 15:47:44 - INFO -   Stage 2: mul8u_LK8.bin - 279.0387 µJ (528,482,304 MACs)
2025-11-21 15:47:44 - INFO -   Stage 3: mul8u_1JJQ.bin - 601.5503 µJ (1,056,964,608 MACs)
2025-11-21 15:47:44 - INFO - Training curves saved for trial 17
2025-11-21 15:47:44 - INFO - Energy breakdown plot saved for trial 17
2025-11-21 15:47:44 - INFO - ----------------------------------------
2025-11-21 15:47:44 - INFO - Trial 18/20
2025-11-21 15:47:44 - INFO - ----------------------------------------
2025-11-21 15:47:44 - INFO - Architecture: {'num_stages': 4, 'blocks_per_stage': 2, 'filters_per_stage': [64, 128, 256, 512], 'mul_map_files': ['./multipliers/mul8u_1JJQ.bin', './multipliers/mul8u_LK8.bin', './multipliers/mul8u_1JJQ.bin', './multipliers/mul8u_1JJQ.bin']}
2025-11-21 16:04:54 - INFO - ----------------------------------------
2025-11-21 16:04:54 - INFO - Trial 18/20
2025-11-21 16:04:54 - INFO - ----------------------------------------
2025-11-21 16:04:54 - INFO - Architecture: {'num_stages': 4, 'blocks_per_stage': 2, 'filters_per_stage': [64, 128, 256, 512], 'mul_map_files': ['./multipliers/mul8u_1JJQ.bin', './multipliers/mul8u_LK8.bin', './multipliers/mul8u_1JJQ.bin', './multipliers/mul8u_1JJQ.bin']}
2025-11-21 16:04:54 - INFO - Exact accuracy: 0.9255
2025-11-21 16:04:54 - INFO - Approx accuracy: 0.9246
2025-11-21 16:04:54 - INFO - Accuracy drop: 0.0009
2025-11-21 16:04:54 - INFO - Total energy: 1107.3036 µJ
2025-11-21 16:04:54 - INFO - STL robustness: 0.0346 (SATISFIED)
2025-11-21 16:04:54 - INFO - Energy breakdown per stage:
2025-11-21 16:04:54 - INFO -   Stage 0: mul8u_1JJQ.bin - 65.4589 µJ (115,015,680 MACs)
2025-11-21 16:04:54 - INFO -   Stage 1: mul8u_LK8.bin - 139.5193 µJ (264,241,152 MACs)
2025-11-21 16:04:54 - INFO -   Stage 2: mul8u_1JJQ.bin - 300.7751 µJ (528,482,304 MACs)
2025-11-21 16:04:54 - INFO -   Stage 3: mul8u_1JJQ.bin - 601.5503 µJ (1,056,964,608 MACs)
2025-11-21 16:04:55 - INFO - Training curves saved for trial 18
2025-11-21 16:04:55 - INFO - Energy breakdown plot saved for trial 18
2025-11-21 16:04:55 - INFO - ----------------------------------------
2025-11-21 16:04:55 - INFO - Trial 19/20
2025-11-21 16:04:55 - INFO - ----------------------------------------
2025-11-21 16:04:55 - INFO - Architecture: {'num_stages': 4, 'blocks_per_stage': 2, 'filters_per_stage': [64, 128, 256, 512], 'mul_map_files': ['./multipliers/mul8u_LK8.bin', './multipliers/mul8u_LK8.bin', './multipliers/mul8u_1JJQ.bin', './multipliers/mul8u_1JJQ.bin']}
2025-11-21 16:21:49 - INFO - ----------------------------------------
2025-11-21 16:21:49 - INFO - Trial 19/20
2025-11-21 16:21:49 - INFO - ----------------------------------------
2025-11-21 16:21:49 - INFO - Architecture: {'num_stages': 4, 'blocks_per_stage': 2, 'filters_per_stage': [64, 128, 256, 512], 'mul_map_files': ['./multipliers/mul8u_LK8.bin', './multipliers/mul8u_LK8.bin', './multipliers/mul8u_1JJQ.bin', './multipliers/mul8u_1JJQ.bin']}
2025-11-21 16:21:49 - INFO - Exact accuracy: 0.9239
2025-11-21 16:21:49 - INFO - Approx accuracy: 0.9240
2025-11-21 16:21:49 - INFO - Accuracy drop: -0.0001
2025-11-21 16:21:49 - INFO - Total energy: 1102.5730 µJ
2025-11-21 16:21:49 - INFO - STL robustness: 0.0340 (SATISFIED)
2025-11-21 16:21:49 - INFO - Energy breakdown per stage:
2025-11-21 16:21:49 - INFO -   Stage 0: mul8u_LK8.bin - 60.7283 µJ (115,015,680 MACs)
2025-11-21 16:21:49 - INFO -   Stage 1: mul8u_LK8.bin - 139.5193 µJ (264,241,152 MACs)
2025-11-21 16:21:49 - INFO -   Stage 2: mul8u_1JJQ.bin - 300.7751 µJ (528,482,304 MACs)
2025-11-21 16:21:49 - INFO -   Stage 3: mul8u_1JJQ.bin - 601.5503 µJ (1,056,964,608 MACs)
2025-11-21 16:21:49 - INFO - Training curves saved for trial 19
2025-11-21 16:21:50 - INFO - Energy breakdown plot saved for trial 19
2025-11-21 16:21:50 - INFO - ----------------------------------------
2025-11-21 16:21:50 - INFO - Trial 20/20
2025-11-21 16:21:50 - INFO - ----------------------------------------
2025-11-21 16:21:50 - INFO - Architecture: {'num_stages': 4, 'blocks_per_stage': 2, 'filters_per_stage': [64, 128, 256, 512], 'mul_map_files': ['./multipliers/mul8u_1JJQ.bin', './multipliers/mul8u_LK8.bin', './multipliers/mul8u_1JJQ.bin', './multipliers/mul8u_1JJQ.bin']}
2025-11-21 16:38:58 - INFO - ----------------------------------------
2025-11-21 16:38:58 - INFO - Trial 20/20
2025-11-21 16:38:58 - INFO - ----------------------------------------
2025-11-21 16:38:58 - INFO - Architecture: {'num_stages': 4, 'blocks_per_stage': 2, 'filters_per_stage': [64, 128, 256, 512], 'mul_map_files': ['./multipliers/mul8u_1JJQ.bin', './multipliers/mul8u_LK8.bin', './multipliers/mul8u_1JJQ.bin', './multipliers/mul8u_1JJQ.bin']}
2025-11-21 16:38:58 - INFO - Exact accuracy: 0.9267
2025-11-21 16:38:58 - INFO - Approx accuracy: 0.9257
2025-11-21 16:38:58 - INFO - Accuracy drop: 0.0010
2025-11-21 16:38:58 - INFO - Total energy: 1107.3036 µJ
2025-11-21 16:38:58 - INFO - STL robustness: 0.0357 (SATISFIED)
2025-11-21 16:38:58 - INFO - Energy breakdown per stage:
2025-11-21 16:38:58 - INFO -   Stage 0: mul8u_1JJQ.bin - 65.4589 µJ (115,015,680 MACs)
2025-11-21 16:38:58 - INFO -   Stage 1: mul8u_LK8.bin - 139.5193 µJ (264,241,152 MACs)
2025-11-21 16:38:58 - INFO -   Stage 2: mul8u_1JJQ.bin - 300.7751 µJ (528,482,304 MACs)
2025-11-21 16:38:58 - INFO -   Stage 3: mul8u_1JJQ.bin - 601.5503 µJ (1,056,964,608 MACs)
2025-11-21 16:38:59 - INFO - Training curves saved for trial 20
2025-11-21 16:38:59 - INFO - Energy breakdown plot saved for trial 20
2025-11-21 16:38:59 - INFO - ============================================================
2025-11-21 16:38:59 - INFO - EXPERIMENT SUMMARY
2025-11-21 16:38:59 - INFO - ============================================================
2025-11-21 16:38:59 - INFO - Best architecture by accuracy:
2025-11-21 16:38:59 - INFO -   Accuracy: 0.9294
2025-11-21 16:38:59 - INFO -   Energy: 1074.6989 µJ
2025-11-21 16:38:59 - INFO -   Architecture: {'num_stages': 4, 'blocks_per_stage': 2, 'filters_per_stage': [64, 128, 256, 512], 'mul_map_files': ['./multipliers/mul8u_1JJQ.bin', './multipliers/mul8u_1JJQ.bin', './multipliers/mul8u_1JJQ.bin', './multipliers/mul8u_LK8.bin']}
2025-11-21 16:38:59 - INFO - 
Best architecture by energy:
2025-11-21 16:38:59 - INFO -   Accuracy: 0.9248
2025-11-21 16:38:59 - INFO -   Energy: 1042.0942 µJ
2025-11-21 16:38:59 - INFO -   Architecture: {'num_stages': 4, 'blocks_per_stage': 2, 'filters_per_stage': [64, 128, 256, 512], 'mul_map_files': ['./multipliers/mul8u_1JJQ.bin', './multipliers/mul8u_LK8.bin', './multipliers/mul8u_LK8.bin', './multipliers/mul8u_LK8.bin']}
2025-11-21 16:38:59 - INFO - 
STL Constraint Statistics:
2025-11-21 16:38:59 - INFO -   Satisfied: 20/20 (100.0%)
2025-11-21 16:38:59 - INFO -   Violated: 0/20 (0.0%)
2025-11-21 16:38:59 - INFO - 
Pareto-optimal architectures: 4 found
2025-11-21 16:38:59 - INFO - ============================================================
2025-11-21 16:38:59 - INFO - Generating publication-quality plots
2025-11-21 16:38:59 - INFO - ============================================================
2025-11-21 16:39:01 - INFO - All plots generated successfully
2025-11-21 16:39:01 - INFO -   energy_vs_accuracy: plots/resnet_bayesian_60ep_20251121_163859/energy/energy_vs_accuracy.png
2025-11-21 16:39:01 - INFO -   pareto_front: plots/resnet_bayesian_60ep_20251121_163859/energy/pareto_front.png
2025-11-21 16:39:01 - INFO -   stl_analysis: plots/resnet_bayesian_60ep_20251121_163859/stl/stl_analysis.png
2025-11-21 16:39:01 - INFO -   energy_breakdown: plots/resnet_bayesian_60ep_20251121_163859/energy/energy_breakdown.png
2025-11-21 16:39:01 - INFO - 
Results saved to: logs/resnet_bayesian_60ep_20251121_105630_results.json
2025-11-21 16:39:01 - INFO - Log file: logs/resnet_bayesian_60ep_20251121_105630.log
