2025-11-23 01:42:10 - INFO - ============================================================
2025-11-23 01:42:10 - INFO - EXPERIMENT CONFIGURATION
2025-11-23 01:42:10 - INFO - ============================================================
2025-11-23 01:42:10 - INFO -   architecture: ResNet-18
2025-11-23 01:42:10 - INFO -   search_algorithm: bayesian
2025-11-23 01:42:10 - INFO -   num_trials: 20
2025-11-23 01:42:10 - INFO -   epochs: 60
2025-11-23 01:42:10 - INFO -   use_stl: True
2025-11-23 01:42:10 - INFO -   quality_constraint: 0.89
2025-11-23 01:42:10 - INFO -   energy_constraint: 5000.0
2025-11-23 01:42:10 - INFO -   search_space: {'num_stages': [4], 'blocks_per_stage': [2], 'base_filters': [64], 'mul_map_files': ['./multipliers/mul8u_1JJQ.bin', './multipliers/mul8u_R92.bin']}
2025-11-23 01:42:10 - INFO -   timestamp: 20251123_014210
2025-11-23 01:42:10 - INFO - ----------------------------------------
2025-11-23 01:42:10 - INFO - Trial 1/20
2025-11-23 01:42:10 - INFO - ----------------------------------------
2025-11-23 01:42:10 - INFO - Architecture: {'num_stages': 4, 'blocks_per_stage': 2, 'filters_per_stage': [64, 128, 256, 512], 'mul_map_files': ['./multipliers/mul8u_R92.bin', './multipliers/mul8u_R92.bin', './multipliers/mul8u_1JJQ.bin', './multipliers/mul8u_R92.bin']}
2025-11-23 01:59:28 - INFO - ----------------------------------------
2025-11-23 01:59:28 - INFO - Trial 1/20
2025-11-23 01:59:28 - INFO - ----------------------------------------
2025-11-23 01:59:28 - INFO - Architecture: {'num_stages': 4, 'blocks_per_stage': 2, 'filters_per_stage': [64, 128, 256, 512], 'mul_map_files': ['./multipliers/mul8u_R92.bin', './multipliers/mul8u_R92.bin', './multipliers/mul8u_1JJQ.bin', './multipliers/mul8u_R92.bin']}
2025-11-23 01:59:28 - INFO - Exact accuracy: 0.9269
2025-11-23 01:59:28 - INFO - Approx accuracy: 0.9286
2025-11-23 01:59:28 - INFO - Accuracy drop: -0.0017
2025-11-23 01:59:28 - INFO - Total energy: 1013.7873 µJ
2025-11-23 01:59:28 - INFO - STL robustness: 0.0386 (SATISFIED)
2025-11-23 01:59:28 - INFO - Energy breakdown per stage:
2025-11-23 01:59:28 - INFO -   Stage 0: mul8u_R92.bin - 57.0995 µJ (115,015,680 MACs)
2025-11-23 01:59:28 - INFO -   Stage 1: mul8u_R92.bin - 131.1825 µJ (264,241,152 MACs)
2025-11-23 01:59:28 - INFO -   Stage 2: mul8u_1JJQ.bin - 300.7751 µJ (528,482,304 MACs)
2025-11-23 01:59:28 - INFO -   Stage 3: mul8u_R92.bin - 524.7301 µJ (1,056,964,608 MACs)
2025-11-23 01:59:29 - INFO - Training curves saved for trial 1
2025-11-23 01:59:29 - INFO - Energy breakdown plot saved for trial 1
2025-11-23 01:59:29 - INFO - ----------------------------------------
2025-11-23 01:59:29 - INFO - Trial 2/20
2025-11-23 01:59:29 - INFO - ----------------------------------------
2025-11-23 01:59:29 - INFO - Architecture: {'num_stages': 4, 'blocks_per_stage': 2, 'filters_per_stage': [64, 128, 256, 512], 'mul_map_files': ['./multipliers/mul8u_1JJQ.bin', './multipliers/mul8u_1JJQ.bin', './multipliers/mul8u_R92.bin', './multipliers/mul8u_1JJQ.bin']}
2025-11-23 02:16:41 - INFO - ----------------------------------------
2025-11-23 02:16:41 - INFO - Trial 2/20
2025-11-23 02:16:41 - INFO - ----------------------------------------
2025-11-23 02:16:41 - INFO - Architecture: {'num_stages': 4, 'blocks_per_stage': 2, 'filters_per_stage': [64, 128, 256, 512], 'mul_map_files': ['./multipliers/mul8u_1JJQ.bin', './multipliers/mul8u_1JJQ.bin', './multipliers/mul8u_R92.bin', './multipliers/mul8u_1JJQ.bin']}
2025-11-23 02:16:41 - INFO - Exact accuracy: 0.9273
2025-11-23 02:16:41 - INFO - Approx accuracy: 0.9275
2025-11-23 02:16:41 - INFO - Accuracy drop: -0.0002
2025-11-23 02:16:41 - INFO - Total energy: 1079.7617 µJ
2025-11-23 02:16:41 - INFO - STL robustness: 0.0375 (SATISFIED)
2025-11-23 02:16:41 - INFO - Energy breakdown per stage:
2025-11-23 02:16:41 - INFO -   Stage 0: mul8u_1JJQ.bin - 65.4589 µJ (115,015,680 MACs)
2025-11-23 02:16:41 - INFO -   Stage 1: mul8u_1JJQ.bin - 150.3876 µJ (264,241,152 MACs)
2025-11-23 02:16:41 - INFO -   Stage 2: mul8u_R92.bin - 262.3650 µJ (528,482,304 MACs)
2025-11-23 02:16:41 - INFO -   Stage 3: mul8u_1JJQ.bin - 601.5503 µJ (1,056,964,608 MACs)
2025-11-23 02:16:41 - INFO - Training curves saved for trial 2
2025-11-23 02:16:41 - INFO - Energy breakdown plot saved for trial 2
2025-11-23 02:16:41 - INFO - ----------------------------------------
2025-11-23 02:16:41 - INFO - Trial 3/20
2025-11-23 02:16:41 - INFO - ----------------------------------------
2025-11-23 02:16:41 - INFO - Architecture: {'num_stages': 4, 'blocks_per_stage': 2, 'filters_per_stage': [64, 128, 256, 512], 'mul_map_files': ['./multipliers/mul8u_R92.bin', './multipliers/mul8u_R92.bin', './multipliers/mul8u_1JJQ.bin', './multipliers/mul8u_R92.bin']}
2025-11-23 02:33:55 - INFO - ----------------------------------------
2025-11-23 02:33:55 - INFO - Trial 3/20
2025-11-23 02:33:55 - INFO - ----------------------------------------
2025-11-23 02:33:55 - INFO - Architecture: {'num_stages': 4, 'blocks_per_stage': 2, 'filters_per_stage': [64, 128, 256, 512], 'mul_map_files': ['./multipliers/mul8u_R92.bin', './multipliers/mul8u_R92.bin', './multipliers/mul8u_1JJQ.bin', './multipliers/mul8u_R92.bin']}
2025-11-23 02:33:55 - INFO - Exact accuracy: 0.9258
2025-11-23 02:33:55 - INFO - Approx accuracy: 0.9256
2025-11-23 02:33:55 - INFO - Accuracy drop: 0.0002
2025-11-23 02:33:55 - INFO - Total energy: 1013.7873 µJ
2025-11-23 02:33:55 - INFO - STL robustness: 0.0356 (SATISFIED)
2025-11-23 02:33:55 - INFO - Energy breakdown per stage:
2025-11-23 02:33:55 - INFO -   Stage 0: mul8u_R92.bin - 57.0995 µJ (115,015,680 MACs)
2025-11-23 02:33:55 - INFO -   Stage 1: mul8u_R92.bin - 131.1825 µJ (264,241,152 MACs)
2025-11-23 02:33:55 - INFO -   Stage 2: mul8u_1JJQ.bin - 300.7751 µJ (528,482,304 MACs)
2025-11-23 02:33:55 - INFO -   Stage 3: mul8u_R92.bin - 524.7301 µJ (1,056,964,608 MACs)
2025-11-23 02:33:55 - INFO - Training curves saved for trial 3
2025-11-23 02:33:55 - INFO - Energy breakdown plot saved for trial 3
2025-11-23 02:33:55 - INFO - ----------------------------------------
2025-11-23 02:33:55 - INFO - Trial 4/20
2025-11-23 02:33:55 - INFO - ----------------------------------------
2025-11-23 02:33:55 - INFO - Architecture: {'num_stages': 4, 'blocks_per_stage': 2, 'filters_per_stage': [64, 128, 256, 512], 'mul_map_files': ['./multipliers/mul8u_1JJQ.bin', './multipliers/mul8u_1JJQ.bin', './multipliers/mul8u_R92.bin', './multipliers/mul8u_R92.bin']}
2025-11-23 02:51:11 - INFO - ----------------------------------------
2025-11-23 02:51:11 - INFO - Trial 4/20
2025-11-23 02:51:11 - INFO - ----------------------------------------
2025-11-23 02:51:11 - INFO - Architecture: {'num_stages': 4, 'blocks_per_stage': 2, 'filters_per_stage': [64, 128, 256, 512], 'mul_map_files': ['./multipliers/mul8u_1JJQ.bin', './multipliers/mul8u_1JJQ.bin', './multipliers/mul8u_R92.bin', './multipliers/mul8u_R92.bin']}
2025-11-23 02:51:11 - INFO - Exact accuracy: 0.9236
2025-11-23 02:51:11 - INFO - Approx accuracy: 0.9257
2025-11-23 02:51:11 - INFO - Accuracy drop: -0.0021
2025-11-23 02:51:11 - INFO - Total energy: 1002.9416 µJ
2025-11-23 02:51:11 - INFO - STL robustness: 0.0357 (SATISFIED)
2025-11-23 02:51:11 - INFO - Energy breakdown per stage:
2025-11-23 02:51:11 - INFO -   Stage 0: mul8u_1JJQ.bin - 65.4589 µJ (115,015,680 MACs)
2025-11-23 02:51:11 - INFO -   Stage 1: mul8u_1JJQ.bin - 150.3876 µJ (264,241,152 MACs)
2025-11-23 02:51:11 - INFO -   Stage 2: mul8u_R92.bin - 262.3650 µJ (528,482,304 MACs)
2025-11-23 02:51:11 - INFO -   Stage 3: mul8u_R92.bin - 524.7301 µJ (1,056,964,608 MACs)
2025-11-23 02:51:12 - INFO - Training curves saved for trial 4
2025-11-23 02:51:12 - INFO - Energy breakdown plot saved for trial 4
2025-11-23 02:51:12 - INFO - ----------------------------------------
2025-11-23 02:51:12 - INFO - Trial 5/20
2025-11-23 02:51:12 - INFO - ----------------------------------------
2025-11-23 02:51:12 - INFO - Architecture: {'num_stages': 4, 'blocks_per_stage': 2, 'filters_per_stage': [64, 128, 256, 512], 'mul_map_files': ['./multipliers/mul8u_1JJQ.bin', './multipliers/mul8u_1JJQ.bin', './multipliers/mul8u_R92.bin', './multipliers/mul8u_R92.bin']}
2025-11-23 03:08:27 - INFO - ----------------------------------------
2025-11-23 03:08:27 - INFO - Trial 5/20
2025-11-23 03:08:27 - INFO - ----------------------------------------
2025-11-23 03:08:27 - INFO - Architecture: {'num_stages': 4, 'blocks_per_stage': 2, 'filters_per_stage': [64, 128, 256, 512], 'mul_map_files': ['./multipliers/mul8u_1JJQ.bin', './multipliers/mul8u_1JJQ.bin', './multipliers/mul8u_R92.bin', './multipliers/mul8u_R92.bin']}
2025-11-23 03:08:27 - INFO - Exact accuracy: 0.9242
2025-11-23 03:08:27 - INFO - Approx accuracy: 0.9236
2025-11-23 03:08:27 - INFO - Accuracy drop: 0.0006
2025-11-23 03:08:27 - INFO - Total energy: 1002.9416 µJ
2025-11-23 03:08:27 - INFO - STL robustness: 0.0336 (SATISFIED)
2025-11-23 03:08:27 - INFO - Energy breakdown per stage:
2025-11-23 03:08:27 - INFO -   Stage 0: mul8u_1JJQ.bin - 65.4589 µJ (115,015,680 MACs)
2025-11-23 03:08:27 - INFO -   Stage 1: mul8u_1JJQ.bin - 150.3876 µJ (264,241,152 MACs)
2025-11-23 03:08:27 - INFO -   Stage 2: mul8u_R92.bin - 262.3650 µJ (528,482,304 MACs)
2025-11-23 03:08:27 - INFO -   Stage 3: mul8u_R92.bin - 524.7301 µJ (1,056,964,608 MACs)
2025-11-23 03:08:27 - INFO - Training curves saved for trial 5
2025-11-23 03:08:27 - INFO - Energy breakdown plot saved for trial 5
2025-11-23 03:08:27 - INFO - ----------------------------------------
2025-11-23 03:08:27 - INFO - Trial 6/20
2025-11-23 03:08:27 - INFO - ----------------------------------------
2025-11-23 03:08:27 - INFO - Architecture: {'num_stages': 4, 'blocks_per_stage': 2, 'filters_per_stage': [64, 128, 256, 512], 'mul_map_files': ['./multipliers/mul8u_1JJQ.bin', './multipliers/mul8u_1JJQ.bin', './multipliers/mul8u_1JJQ.bin', './multipliers/mul8u_1JJQ.bin']}
2025-11-23 03:25:46 - INFO - ----------------------------------------
2025-11-23 03:25:46 - INFO - Trial 6/20
2025-11-23 03:25:46 - INFO - ----------------------------------------
2025-11-23 03:25:46 - INFO - Architecture: {'num_stages': 4, 'blocks_per_stage': 2, 'filters_per_stage': [64, 128, 256, 512], 'mul_map_files': ['./multipliers/mul8u_1JJQ.bin', './multipliers/mul8u_1JJQ.bin', './multipliers/mul8u_1JJQ.bin', './multipliers/mul8u_1JJQ.bin']}
2025-11-23 03:25:46 - INFO - Exact accuracy: 0.9272
2025-11-23 03:25:46 - INFO - Approx accuracy: 0.9276
2025-11-23 03:25:46 - INFO - Accuracy drop: -0.0004
2025-11-23 03:25:46 - INFO - Total energy: 1118.1718 µJ
2025-11-23 03:25:46 - INFO - STL robustness: 0.0376 (SATISFIED)
2025-11-23 03:25:46 - INFO - Energy breakdown per stage:
2025-11-23 03:25:46 - INFO -   Stage 0: mul8u_1JJQ.bin - 65.4589 µJ (115,015,680 MACs)
2025-11-23 03:25:46 - INFO -   Stage 1: mul8u_1JJQ.bin - 150.3876 µJ (264,241,152 MACs)
2025-11-23 03:25:46 - INFO -   Stage 2: mul8u_1JJQ.bin - 300.7751 µJ (528,482,304 MACs)
2025-11-23 03:25:46 - INFO -   Stage 3: mul8u_1JJQ.bin - 601.5503 µJ (1,056,964,608 MACs)
2025-11-23 03:25:46 - INFO - Training curves saved for trial 6
2025-11-23 03:25:47 - INFO - Energy breakdown plot saved for trial 6
2025-11-23 03:25:47 - INFO - ----------------------------------------
2025-11-23 03:25:47 - INFO - Trial 7/20
2025-11-23 03:25:47 - INFO - ----------------------------------------
2025-11-23 03:25:47 - INFO - Architecture: {'num_stages': 4, 'blocks_per_stage': 2, 'filters_per_stage': [64, 128, 256, 512], 'mul_map_files': ['./multipliers/mul8u_R92.bin', './multipliers/mul8u_1JJQ.bin', './multipliers/mul8u_1JJQ.bin', './multipliers/mul8u_1JJQ.bin']}
2025-11-23 03:43:02 - INFO - ----------------------------------------
2025-11-23 03:43:02 - INFO - Trial 7/20
2025-11-23 03:43:02 - INFO - ----------------------------------------
2025-11-23 03:43:02 - INFO - Architecture: {'num_stages': 4, 'blocks_per_stage': 2, 'filters_per_stage': [64, 128, 256, 512], 'mul_map_files': ['./multipliers/mul8u_R92.bin', './multipliers/mul8u_1JJQ.bin', './multipliers/mul8u_1JJQ.bin', './multipliers/mul8u_1JJQ.bin']}
2025-11-23 03:43:02 - INFO - Exact accuracy: 0.9235
2025-11-23 03:43:02 - INFO - Approx accuracy: 0.9296
2025-11-23 03:43:02 - INFO - Accuracy drop: -0.0061
2025-11-23 03:43:02 - INFO - Total energy: 1109.8125 µJ
2025-11-23 03:43:02 - INFO - STL robustness: 0.0396 (SATISFIED)
2025-11-23 03:43:02 - INFO - Energy breakdown per stage:
2025-11-23 03:43:02 - INFO -   Stage 0: mul8u_R92.bin - 57.0995 µJ (115,015,680 MACs)
2025-11-23 03:43:02 - INFO -   Stage 1: mul8u_1JJQ.bin - 150.3876 µJ (264,241,152 MACs)
2025-11-23 03:43:02 - INFO -   Stage 2: mul8u_1JJQ.bin - 300.7751 µJ (528,482,304 MACs)
2025-11-23 03:43:02 - INFO -   Stage 3: mul8u_1JJQ.bin - 601.5503 µJ (1,056,964,608 MACs)
2025-11-23 03:43:03 - INFO - Training curves saved for trial 7
2025-11-23 03:43:03 - INFO - Energy breakdown plot saved for trial 7
2025-11-23 03:43:03 - INFO - ----------------------------------------
2025-11-23 03:43:03 - INFO - Trial 8/20
2025-11-23 03:43:03 - INFO - ----------------------------------------
2025-11-23 03:43:03 - INFO - Architecture: {'num_stages': 4, 'blocks_per_stage': 2, 'filters_per_stage': [64, 128, 256, 512], 'mul_map_files': ['./multipliers/mul8u_1JJQ.bin', './multipliers/mul8u_1JJQ.bin', './multipliers/mul8u_1JJQ.bin', './multipliers/mul8u_R92.bin']}
2025-11-23 04:00:19 - INFO - ----------------------------------------
2025-11-23 04:00:19 - INFO - Trial 8/20
2025-11-23 04:00:19 - INFO - ----------------------------------------
2025-11-23 04:00:19 - INFO - Architecture: {'num_stages': 4, 'blocks_per_stage': 2, 'filters_per_stage': [64, 128, 256, 512], 'mul_map_files': ['./multipliers/mul8u_1JJQ.bin', './multipliers/mul8u_1JJQ.bin', './multipliers/mul8u_1JJQ.bin', './multipliers/mul8u_R92.bin']}
2025-11-23 04:00:19 - INFO - Exact accuracy: 0.9277
2025-11-23 04:00:19 - INFO - Approx accuracy: 0.9281
2025-11-23 04:00:19 - INFO - Accuracy drop: -0.0004
2025-11-23 04:00:19 - INFO - Total energy: 1041.3517 µJ
2025-11-23 04:00:19 - INFO - STL robustness: 0.0381 (SATISFIED)
2025-11-23 04:00:19 - INFO - Energy breakdown per stage:
2025-11-23 04:00:19 - INFO -   Stage 0: mul8u_1JJQ.bin - 65.4589 µJ (115,015,680 MACs)
2025-11-23 04:00:19 - INFO -   Stage 1: mul8u_1JJQ.bin - 150.3876 µJ (264,241,152 MACs)
2025-11-23 04:00:19 - INFO -   Stage 2: mul8u_1JJQ.bin - 300.7751 µJ (528,482,304 MACs)
2025-11-23 04:00:19 - INFO -   Stage 3: mul8u_R92.bin - 524.7301 µJ (1,056,964,608 MACs)
2025-11-23 04:00:20 - INFO - Training curves saved for trial 8
2025-11-23 04:00:20 - INFO - Energy breakdown plot saved for trial 8
2025-11-23 04:00:20 - INFO - ----------------------------------------
2025-11-23 04:00:20 - INFO - Trial 9/20
2025-11-23 04:00:20 - INFO - ----------------------------------------
2025-11-23 04:00:20 - INFO - Architecture: {'num_stages': 4, 'blocks_per_stage': 2, 'filters_per_stage': [64, 128, 256, 512], 'mul_map_files': ['./multipliers/mul8u_R92.bin', './multipliers/mul8u_1JJQ.bin', './multipliers/mul8u_1JJQ.bin', './multipliers/mul8u_1JJQ.bin']}
2025-11-23 04:17:35 - INFO - ----------------------------------------
2025-11-23 04:17:35 - INFO - Trial 9/20
2025-11-23 04:17:35 - INFO - ----------------------------------------
2025-11-23 04:17:35 - INFO - Architecture: {'num_stages': 4, 'blocks_per_stage': 2, 'filters_per_stage': [64, 128, 256, 512], 'mul_map_files': ['./multipliers/mul8u_R92.bin', './multipliers/mul8u_1JJQ.bin', './multipliers/mul8u_1JJQ.bin', './multipliers/mul8u_1JJQ.bin']}
2025-11-23 04:17:35 - INFO - Exact accuracy: 0.9252
2025-11-23 04:17:35 - INFO - Approx accuracy: 0.9287
2025-11-23 04:17:35 - INFO - Accuracy drop: -0.0035
2025-11-23 04:17:35 - INFO - Total energy: 1109.8125 µJ
2025-11-23 04:17:35 - INFO - STL robustness: 0.0387 (SATISFIED)
2025-11-23 04:17:35 - INFO - Energy breakdown per stage:
2025-11-23 04:17:35 - INFO -   Stage 0: mul8u_R92.bin - 57.0995 µJ (115,015,680 MACs)
2025-11-23 04:17:35 - INFO -   Stage 1: mul8u_1JJQ.bin - 150.3876 µJ (264,241,152 MACs)
2025-11-23 04:17:35 - INFO -   Stage 2: mul8u_1JJQ.bin - 300.7751 µJ (528,482,304 MACs)
2025-11-23 04:17:35 - INFO -   Stage 3: mul8u_1JJQ.bin - 601.5503 µJ (1,056,964,608 MACs)
2025-11-23 04:17:36 - INFO - Training curves saved for trial 9
2025-11-23 04:17:36 - INFO - Energy breakdown plot saved for trial 9
2025-11-23 04:17:36 - INFO - ----------------------------------------
2025-11-23 04:17:36 - INFO - Trial 10/20
2025-11-23 04:17:36 - INFO - ----------------------------------------
2025-11-23 04:17:36 - INFO - Architecture: {'num_stages': 4, 'blocks_per_stage': 2, 'filters_per_stage': [64, 128, 256, 512], 'mul_map_files': ['./multipliers/mul8u_1JJQ.bin', './multipliers/mul8u_1JJQ.bin', './multipliers/mul8u_1JJQ.bin', './multipliers/mul8u_1JJQ.bin']}
2025-11-23 04:34:49 - INFO - ----------------------------------------
2025-11-23 04:34:49 - INFO - Trial 10/20
2025-11-23 04:34:49 - INFO - ----------------------------------------
2025-11-23 04:34:49 - INFO - Architecture: {'num_stages': 4, 'blocks_per_stage': 2, 'filters_per_stage': [64, 128, 256, 512], 'mul_map_files': ['./multipliers/mul8u_1JJQ.bin', './multipliers/mul8u_1JJQ.bin', './multipliers/mul8u_1JJQ.bin', './multipliers/mul8u_1JJQ.bin']}
2025-11-23 04:34:49 - INFO - Exact accuracy: 0.9293
2025-11-23 04:34:49 - INFO - Approx accuracy: 0.9289
2025-11-23 04:34:49 - INFO - Accuracy drop: 0.0004
2025-11-23 04:34:49 - INFO - Total energy: 1118.1718 µJ
2025-11-23 04:34:49 - INFO - STL robustness: 0.0389 (SATISFIED)
2025-11-23 04:34:49 - INFO - Energy breakdown per stage:
2025-11-23 04:34:49 - INFO -   Stage 0: mul8u_1JJQ.bin - 65.4589 µJ (115,015,680 MACs)
2025-11-23 04:34:49 - INFO -   Stage 1: mul8u_1JJQ.bin - 150.3876 µJ (264,241,152 MACs)
2025-11-23 04:34:49 - INFO -   Stage 2: mul8u_1JJQ.bin - 300.7751 µJ (528,482,304 MACs)
2025-11-23 04:34:49 - INFO -   Stage 3: mul8u_1JJQ.bin - 601.5503 µJ (1,056,964,608 MACs)
2025-11-23 04:34:50 - INFO - Training curves saved for trial 10
2025-11-23 04:34:50 - INFO - Energy breakdown plot saved for trial 10
2025-11-23 04:34:50 - INFO - ----------------------------------------
2025-11-23 04:34:50 - INFO - Trial 11/20
2025-11-23 04:34:50 - INFO - ----------------------------------------
2025-11-23 04:34:50 - INFO - Architecture: {'num_stages': 4, 'blocks_per_stage': 2, 'filters_per_stage': [64, 128, 256, 512], 'mul_map_files': ['./multipliers/mul8u_R92.bin', './multipliers/mul8u_R92.bin', './multipliers/mul8u_1JJQ.bin', './multipliers/mul8u_1JJQ.bin']}
2025-11-23 04:52:05 - INFO - ----------------------------------------
2025-11-23 04:52:05 - INFO - Trial 11/20
2025-11-23 04:52:05 - INFO - ----------------------------------------
2025-11-23 04:52:05 - INFO - Architecture: {'num_stages': 4, 'blocks_per_stage': 2, 'filters_per_stage': [64, 128, 256, 512], 'mul_map_files': ['./multipliers/mul8u_R92.bin', './multipliers/mul8u_R92.bin', './multipliers/mul8u_1JJQ.bin', './multipliers/mul8u_1JJQ.bin']}
2025-11-23 04:52:05 - INFO - Exact accuracy: 0.9251
2025-11-23 04:52:05 - INFO - Approx accuracy: 0.9237
2025-11-23 04:52:05 - INFO - Accuracy drop: 0.0014
2025-11-23 04:52:05 - INFO - Total energy: 1090.6075 µJ
2025-11-23 04:52:05 - INFO - STL robustness: 0.0337 (SATISFIED)
2025-11-23 04:52:05 - INFO - Energy breakdown per stage:
2025-11-23 04:52:05 - INFO -   Stage 0: mul8u_R92.bin - 57.0995 µJ (115,015,680 MACs)
2025-11-23 04:52:05 - INFO -   Stage 1: mul8u_R92.bin - 131.1825 µJ (264,241,152 MACs)
2025-11-23 04:52:05 - INFO -   Stage 2: mul8u_1JJQ.bin - 300.7751 µJ (528,482,304 MACs)
2025-11-23 04:52:05 - INFO -   Stage 3: mul8u_1JJQ.bin - 601.5503 µJ (1,056,964,608 MACs)
2025-11-23 04:52:06 - INFO - Training curves saved for trial 11
2025-11-23 04:52:06 - INFO - Energy breakdown plot saved for trial 11
2025-11-23 04:52:06 - INFO - ----------------------------------------
2025-11-23 04:52:06 - INFO - Trial 12/20
2025-11-23 04:52:06 - INFO - ----------------------------------------
2025-11-23 04:52:06 - INFO - Architecture: {'num_stages': 4, 'blocks_per_stage': 2, 'filters_per_stage': [64, 128, 256, 512], 'mul_map_files': ['./multipliers/mul8u_1JJQ.bin', './multipliers/mul8u_R92.bin', './multipliers/mul8u_R92.bin', './multipliers/mul8u_R92.bin']}
2025-11-23 05:09:24 - INFO - ----------------------------------------
2025-11-23 05:09:24 - INFO - Trial 12/20
2025-11-23 05:09:24 - INFO - ----------------------------------------
2025-11-23 05:09:24 - INFO - Architecture: {'num_stages': 4, 'blocks_per_stage': 2, 'filters_per_stage': [64, 128, 256, 512], 'mul_map_files': ['./multipliers/mul8u_1JJQ.bin', './multipliers/mul8u_R92.bin', './multipliers/mul8u_R92.bin', './multipliers/mul8u_R92.bin']}
2025-11-23 05:09:24 - INFO - Exact accuracy: 0.9241
2025-11-23 05:09:24 - INFO - Approx accuracy: 0.9208
2025-11-23 05:09:24 - INFO - Accuracy drop: 0.0033
2025-11-23 05:09:24 - INFO - Total energy: 983.7365 µJ
2025-11-23 05:09:24 - INFO - STL robustness: 0.0308 (SATISFIED)
2025-11-23 05:09:24 - INFO - Energy breakdown per stage:
2025-11-23 05:09:24 - INFO -   Stage 0: mul8u_1JJQ.bin - 65.4589 µJ (115,015,680 MACs)
2025-11-23 05:09:24 - INFO -   Stage 1: mul8u_R92.bin - 131.1825 µJ (264,241,152 MACs)
2025-11-23 05:09:24 - INFO -   Stage 2: mul8u_R92.bin - 262.3650 µJ (528,482,304 MACs)
2025-11-23 05:09:24 - INFO -   Stage 3: mul8u_R92.bin - 524.7301 µJ (1,056,964,608 MACs)
2025-11-23 05:09:25 - INFO - Training curves saved for trial 12
2025-11-23 05:09:25 - INFO - Energy breakdown plot saved for trial 12
2025-11-23 05:09:25 - INFO - ----------------------------------------
2025-11-23 05:09:25 - INFO - Trial 13/20
2025-11-23 05:09:25 - INFO - ----------------------------------------
2025-11-23 05:09:25 - INFO - Architecture: {'num_stages': 4, 'blocks_per_stage': 2, 'filters_per_stage': [64, 128, 256, 512], 'mul_map_files': ['./multipliers/mul8u_1JJQ.bin', './multipliers/mul8u_1JJQ.bin', './multipliers/mul8u_R92.bin', './multipliers/mul8u_R92.bin']}
2025-11-23 05:26:43 - INFO - ----------------------------------------
2025-11-23 05:26:43 - INFO - Trial 13/20
2025-11-23 05:26:43 - INFO - ----------------------------------------
2025-11-23 05:26:43 - INFO - Architecture: {'num_stages': 4, 'blocks_per_stage': 2, 'filters_per_stage': [64, 128, 256, 512], 'mul_map_files': ['./multipliers/mul8u_1JJQ.bin', './multipliers/mul8u_1JJQ.bin', './multipliers/mul8u_R92.bin', './multipliers/mul8u_R92.bin']}
2025-11-23 05:26:43 - INFO - Exact accuracy: 0.9252
2025-11-23 05:26:43 - INFO - Approx accuracy: 0.9257
2025-11-23 05:26:43 - INFO - Accuracy drop: -0.0005
2025-11-23 05:26:43 - INFO - Total energy: 1002.9416 µJ
2025-11-23 05:26:43 - INFO - STL robustness: 0.0357 (SATISFIED)
2025-11-23 05:26:43 - INFO - Energy breakdown per stage:
2025-11-23 05:26:43 - INFO -   Stage 0: mul8u_1JJQ.bin - 65.4589 µJ (115,015,680 MACs)
2025-11-23 05:26:43 - INFO -   Stage 1: mul8u_1JJQ.bin - 150.3876 µJ (264,241,152 MACs)
2025-11-23 05:26:43 - INFO -   Stage 2: mul8u_R92.bin - 262.3650 µJ (528,482,304 MACs)
2025-11-23 05:26:43 - INFO -   Stage 3: mul8u_R92.bin - 524.7301 µJ (1,056,964,608 MACs)
2025-11-23 05:26:43 - INFO - Training curves saved for trial 13
2025-11-23 05:26:43 - INFO - Energy breakdown plot saved for trial 13
2025-11-23 05:26:43 - INFO - ----------------------------------------
2025-11-23 05:26:43 - INFO - Trial 14/20
2025-11-23 05:26:43 - INFO - ----------------------------------------
2025-11-23 05:26:43 - INFO - Architecture: {'num_stages': 4, 'blocks_per_stage': 2, 'filters_per_stage': [64, 128, 256, 512], 'mul_map_files': ['./multipliers/mul8u_1JJQ.bin', './multipliers/mul8u_R92.bin', './multipliers/mul8u_1JJQ.bin', './multipliers/mul8u_1JJQ.bin']}
2025-11-23 05:44:04 - INFO - ----------------------------------------
2025-11-23 05:44:04 - INFO - Trial 14/20
2025-11-23 05:44:04 - INFO - ----------------------------------------
2025-11-23 05:44:04 - INFO - Architecture: {'num_stages': 4, 'blocks_per_stage': 2, 'filters_per_stage': [64, 128, 256, 512], 'mul_map_files': ['./multipliers/mul8u_1JJQ.bin', './multipliers/mul8u_R92.bin', './multipliers/mul8u_1JJQ.bin', './multipliers/mul8u_1JJQ.bin']}
2025-11-23 05:44:04 - INFO - Exact accuracy: 0.9216
2025-11-23 05:44:04 - INFO - Approx accuracy: 0.9164
2025-11-23 05:44:04 - INFO - Accuracy drop: 0.0052
2025-11-23 05:44:04 - INFO - Total energy: 1098.9668 µJ
2025-11-23 05:44:04 - INFO - STL robustness: 0.0264 (SATISFIED)
2025-11-23 05:44:04 - INFO - Energy breakdown per stage:
2025-11-23 05:44:04 - INFO -   Stage 0: mul8u_1JJQ.bin - 65.4589 µJ (115,015,680 MACs)
2025-11-23 05:44:04 - INFO -   Stage 1: mul8u_R92.bin - 131.1825 µJ (264,241,152 MACs)
2025-11-23 05:44:04 - INFO -   Stage 2: mul8u_1JJQ.bin - 300.7751 µJ (528,482,304 MACs)
2025-11-23 05:44:04 - INFO -   Stage 3: mul8u_1JJQ.bin - 601.5503 µJ (1,056,964,608 MACs)
2025-11-23 05:44:05 - INFO - Training curves saved for trial 14
2025-11-23 05:44:05 - INFO - Energy breakdown plot saved for trial 14
2025-11-23 05:44:05 - INFO - ----------------------------------------
2025-11-23 05:44:05 - INFO - Trial 15/20
2025-11-23 05:44:05 - INFO - ----------------------------------------
2025-11-23 05:44:05 - INFO - Architecture: {'num_stages': 4, 'blocks_per_stage': 2, 'filters_per_stage': [64, 128, 256, 512], 'mul_map_files': ['./multipliers/mul8u_1JJQ.bin', './multipliers/mul8u_R92.bin', './multipliers/mul8u_1JJQ.bin', './multipliers/mul8u_R92.bin']}
2025-11-23 06:01:23 - INFO - ----------------------------------------
2025-11-23 06:01:23 - INFO - Trial 15/20
2025-11-23 06:01:23 - INFO - ----------------------------------------
2025-11-23 06:01:23 - INFO - Architecture: {'num_stages': 4, 'blocks_per_stage': 2, 'filters_per_stage': [64, 128, 256, 512], 'mul_map_files': ['./multipliers/mul8u_1JJQ.bin', './multipliers/mul8u_R92.bin', './multipliers/mul8u_1JJQ.bin', './multipliers/mul8u_R92.bin']}
2025-11-23 06:01:23 - INFO - Exact accuracy: 0.9271
2025-11-23 06:01:23 - INFO - Approx accuracy: 0.9225
2025-11-23 06:01:23 - INFO - Accuracy drop: 0.0046
2025-11-23 06:01:23 - INFO - Total energy: 1022.1466 µJ
2025-11-23 06:01:23 - INFO - STL robustness: 0.0325 (SATISFIED)
2025-11-23 06:01:23 - INFO - Energy breakdown per stage:
2025-11-23 06:01:23 - INFO -   Stage 0: mul8u_1JJQ.bin - 65.4589 µJ (115,015,680 MACs)
2025-11-23 06:01:23 - INFO -   Stage 1: mul8u_R92.bin - 131.1825 µJ (264,241,152 MACs)
2025-11-23 06:01:23 - INFO -   Stage 2: mul8u_1JJQ.bin - 300.7751 µJ (528,482,304 MACs)
2025-11-23 06:01:23 - INFO -   Stage 3: mul8u_R92.bin - 524.7301 µJ (1,056,964,608 MACs)
2025-11-23 06:01:24 - INFO - Training curves saved for trial 15
2025-11-23 06:01:24 - INFO - Energy breakdown plot saved for trial 15
2025-11-23 06:01:24 - INFO - ----------------------------------------
2025-11-23 06:01:24 - INFO - Trial 16/20
2025-11-23 06:01:24 - INFO - ----------------------------------------
2025-11-23 06:01:24 - INFO - Architecture: {'num_stages': 4, 'blocks_per_stage': 2, 'filters_per_stage': [64, 128, 256, 512], 'mul_map_files': ['./multipliers/mul8u_R92.bin', './multipliers/mul8u_1JJQ.bin', './multipliers/mul8u_R92.bin', './multipliers/mul8u_1JJQ.bin']}
2025-11-23 06:18:42 - INFO - ----------------------------------------
2025-11-23 06:18:42 - INFO - Trial 16/20
2025-11-23 06:18:42 - INFO - ----------------------------------------
2025-11-23 06:18:42 - INFO - Architecture: {'num_stages': 4, 'blocks_per_stage': 2, 'filters_per_stage': [64, 128, 256, 512], 'mul_map_files': ['./multipliers/mul8u_R92.bin', './multipliers/mul8u_1JJQ.bin', './multipliers/mul8u_R92.bin', './multipliers/mul8u_1JJQ.bin']}
2025-11-23 06:18:42 - INFO - Exact accuracy: 0.9289
2025-11-23 06:18:42 - INFO - Approx accuracy: 0.9317
2025-11-23 06:18:42 - INFO - Accuracy drop: -0.0028
2025-11-23 06:18:42 - INFO - Total energy: 1071.4024 µJ
2025-11-23 06:18:42 - INFO - STL robustness: 0.0417 (SATISFIED)
2025-11-23 06:18:42 - INFO - Energy breakdown per stage:
2025-11-23 06:18:42 - INFO -   Stage 0: mul8u_R92.bin - 57.0995 µJ (115,015,680 MACs)
2025-11-23 06:18:42 - INFO -   Stage 1: mul8u_1JJQ.bin - 150.3876 µJ (264,241,152 MACs)
2025-11-23 06:18:42 - INFO -   Stage 2: mul8u_R92.bin - 262.3650 µJ (528,482,304 MACs)
2025-11-23 06:18:42 - INFO -   Stage 3: mul8u_1JJQ.bin - 601.5503 µJ (1,056,964,608 MACs)
2025-11-23 06:18:42 - INFO - Training curves saved for trial 16
2025-11-23 06:18:42 - INFO - Energy breakdown plot saved for trial 16
2025-11-23 06:18:42 - INFO - ----------------------------------------
2025-11-23 06:18:42 - INFO - Trial 17/20
2025-11-23 06:18:42 - INFO - ----------------------------------------
2025-11-23 06:18:42 - INFO - Architecture: {'num_stages': 4, 'blocks_per_stage': 2, 'filters_per_stage': [64, 128, 256, 512], 'mul_map_files': ['./multipliers/mul8u_R92.bin', './multipliers/mul8u_R92.bin', './multipliers/mul8u_R92.bin', './multipliers/mul8u_R92.bin']}
2025-11-23 06:35:59 - INFO - ----------------------------------------
2025-11-23 06:35:59 - INFO - Trial 17/20
2025-11-23 06:35:59 - INFO - ----------------------------------------
2025-11-23 06:35:59 - INFO - Architecture: {'num_stages': 4, 'blocks_per_stage': 2, 'filters_per_stage': [64, 128, 256, 512], 'mul_map_files': ['./multipliers/mul8u_R92.bin', './multipliers/mul8u_R92.bin', './multipliers/mul8u_R92.bin', './multipliers/mul8u_R92.bin']}
2025-11-23 06:35:59 - INFO - Exact accuracy: 0.9227
2025-11-23 06:35:59 - INFO - Approx accuracy: 0.9241
2025-11-23 06:35:59 - INFO - Accuracy drop: -0.0014
2025-11-23 06:35:59 - INFO - Total energy: 975.3772 µJ
2025-11-23 06:35:59 - INFO - STL robustness: 0.0341 (SATISFIED)
2025-11-23 06:35:59 - INFO - Energy breakdown per stage:
2025-11-23 06:35:59 - INFO -   Stage 0: mul8u_R92.bin - 57.0995 µJ (115,015,680 MACs)
2025-11-23 06:35:59 - INFO -   Stage 1: mul8u_R92.bin - 131.1825 µJ (264,241,152 MACs)
2025-11-23 06:35:59 - INFO -   Stage 2: mul8u_R92.bin - 262.3650 µJ (528,482,304 MACs)
2025-11-23 06:35:59 - INFO -   Stage 3: mul8u_R92.bin - 524.7301 µJ (1,056,964,608 MACs)
2025-11-23 06:36:00 - INFO - Training curves saved for trial 17
2025-11-23 06:36:00 - INFO - Energy breakdown plot saved for trial 17
2025-11-23 06:36:00 - INFO - ----------------------------------------
2025-11-23 06:36:00 - INFO - Trial 18/20
2025-11-23 06:36:00 - INFO - ----------------------------------------
2025-11-23 06:36:00 - INFO - Architecture: {'num_stages': 4, 'blocks_per_stage': 2, 'filters_per_stage': [64, 128, 256, 512], 'mul_map_files': ['./multipliers/mul8u_R92.bin', './multipliers/mul8u_1JJQ.bin', './multipliers/mul8u_R92.bin', './multipliers/mul8u_1JJQ.bin']}
2025-11-23 06:53:23 - INFO - ----------------------------------------
2025-11-23 06:53:23 - INFO - Trial 18/20
2025-11-23 06:53:23 - INFO - ----------------------------------------
2025-11-23 06:53:23 - INFO - Architecture: {'num_stages': 4, 'blocks_per_stage': 2, 'filters_per_stage': [64, 128, 256, 512], 'mul_map_files': ['./multipliers/mul8u_R92.bin', './multipliers/mul8u_1JJQ.bin', './multipliers/mul8u_R92.bin', './multipliers/mul8u_1JJQ.bin']}
2025-11-23 06:53:23 - INFO - Exact accuracy: 0.9298
2025-11-23 06:53:23 - INFO - Approx accuracy: 0.9306
2025-11-23 06:53:23 - INFO - Accuracy drop: -0.0008
2025-11-23 06:53:23 - INFO - Total energy: 1071.4024 µJ
2025-11-23 06:53:23 - INFO - STL robustness: 0.0406 (SATISFIED)
2025-11-23 06:53:23 - INFO - Energy breakdown per stage:
2025-11-23 06:53:23 - INFO -   Stage 0: mul8u_R92.bin - 57.0995 µJ (115,015,680 MACs)
2025-11-23 06:53:23 - INFO -   Stage 1: mul8u_1JJQ.bin - 150.3876 µJ (264,241,152 MACs)
2025-11-23 06:53:23 - INFO -   Stage 2: mul8u_R92.bin - 262.3650 µJ (528,482,304 MACs)
2025-11-23 06:53:23 - INFO -   Stage 3: mul8u_1JJQ.bin - 601.5503 µJ (1,056,964,608 MACs)
2025-11-23 06:53:23 - INFO - Training curves saved for trial 18
2025-11-23 06:53:23 - INFO - Energy breakdown plot saved for trial 18
2025-11-23 06:53:23 - INFO - ----------------------------------------
2025-11-23 06:53:23 - INFO - Trial 19/20
2025-11-23 06:53:23 - INFO - ----------------------------------------
2025-11-23 06:53:23 - INFO - Architecture: {'num_stages': 4, 'blocks_per_stage': 2, 'filters_per_stage': [64, 128, 256, 512], 'mul_map_files': ['./multipliers/mul8u_1JJQ.bin', './multipliers/mul8u_1JJQ.bin', './multipliers/mul8u_R92.bin', './multipliers/mul8u_R92.bin']}
2025-11-23 07:10:43 - INFO - ----------------------------------------
2025-11-23 07:10:43 - INFO - Trial 19/20
2025-11-23 07:10:43 - INFO - ----------------------------------------
2025-11-23 07:10:43 - INFO - Architecture: {'num_stages': 4, 'blocks_per_stage': 2, 'filters_per_stage': [64, 128, 256, 512], 'mul_map_files': ['./multipliers/mul8u_1JJQ.bin', './multipliers/mul8u_1JJQ.bin', './multipliers/mul8u_R92.bin', './multipliers/mul8u_R92.bin']}
2025-11-23 07:10:43 - INFO - Exact accuracy: 0.9236
2025-11-23 07:10:43 - INFO - Approx accuracy: 0.9256
2025-11-23 07:10:43 - INFO - Accuracy drop: -0.0020
2025-11-23 07:10:43 - INFO - Total energy: 1002.9416 µJ
2025-11-23 07:10:43 - INFO - STL robustness: 0.0356 (SATISFIED)
2025-11-23 07:10:43 - INFO - Energy breakdown per stage:
2025-11-23 07:10:43 - INFO -   Stage 0: mul8u_1JJQ.bin - 65.4589 µJ (115,015,680 MACs)
2025-11-23 07:10:43 - INFO -   Stage 1: mul8u_1JJQ.bin - 150.3876 µJ (264,241,152 MACs)
2025-11-23 07:10:43 - INFO -   Stage 2: mul8u_R92.bin - 262.3650 µJ (528,482,304 MACs)
2025-11-23 07:10:43 - INFO -   Stage 3: mul8u_R92.bin - 524.7301 µJ (1,056,964,608 MACs)
2025-11-23 07:10:43 - INFO - Training curves saved for trial 19
2025-11-23 07:10:44 - INFO - Energy breakdown plot saved for trial 19
2025-11-23 07:10:44 - INFO - ----------------------------------------
2025-11-23 07:10:44 - INFO - Trial 20/20
2025-11-23 07:10:44 - INFO - ----------------------------------------
2025-11-23 07:10:44 - INFO - Architecture: {'num_stages': 4, 'blocks_per_stage': 2, 'filters_per_stage': [64, 128, 256, 512], 'mul_map_files': ['./multipliers/mul8u_1JJQ.bin', './multipliers/mul8u_1JJQ.bin', './multipliers/mul8u_R92.bin', './multipliers/mul8u_1JJQ.bin']}
2025-11-23 07:28:03 - INFO - ----------------------------------------
2025-11-23 07:28:03 - INFO - Trial 20/20
2025-11-23 07:28:03 - INFO - ----------------------------------------
2025-11-23 07:28:03 - INFO - Architecture: {'num_stages': 4, 'blocks_per_stage': 2, 'filters_per_stage': [64, 128, 256, 512], 'mul_map_files': ['./multipliers/mul8u_1JJQ.bin', './multipliers/mul8u_1JJQ.bin', './multipliers/mul8u_R92.bin', './multipliers/mul8u_1JJQ.bin']}
2025-11-23 07:28:03 - INFO - Exact accuracy: 0.9300
2025-11-23 07:28:03 - INFO - Approx accuracy: 0.9295
2025-11-23 07:28:03 - INFO - Accuracy drop: 0.0005
2025-11-23 07:28:03 - INFO - Total energy: 1079.7617 µJ
2025-11-23 07:28:03 - INFO - STL robustness: 0.0395 (SATISFIED)
2025-11-23 07:28:03 - INFO - Energy breakdown per stage:
2025-11-23 07:28:03 - INFO -   Stage 0: mul8u_1JJQ.bin - 65.4589 µJ (115,015,680 MACs)
2025-11-23 07:28:03 - INFO -   Stage 1: mul8u_1JJQ.bin - 150.3876 µJ (264,241,152 MACs)
2025-11-23 07:28:03 - INFO -   Stage 2: mul8u_R92.bin - 262.3650 µJ (528,482,304 MACs)
2025-11-23 07:28:03 - INFO -   Stage 3: mul8u_1JJQ.bin - 601.5503 µJ (1,056,964,608 MACs)
2025-11-23 07:28:03 - INFO - Training curves saved for trial 20
2025-11-23 07:28:04 - INFO - Energy breakdown plot saved for trial 20
2025-11-23 07:28:04 - INFO - ============================================================
2025-11-23 07:28:04 - INFO - EXPERIMENT SUMMARY
2025-11-23 07:28:04 - INFO - ============================================================
2025-11-23 07:28:04 - INFO - Best architecture by accuracy:
2025-11-23 07:28:04 - INFO -   Accuracy: 0.9317
2025-11-23 07:28:04 - INFO -   Energy: 1071.4024 µJ
2025-11-23 07:28:04 - INFO -   Architecture: {'num_stages': 4, 'blocks_per_stage': 2, 'filters_per_stage': [64, 128, 256, 512], 'mul_map_files': ['./multipliers/mul8u_R92.bin', './multipliers/mul8u_1JJQ.bin', './multipliers/mul8u_R92.bin', './multipliers/mul8u_1JJQ.bin']}
2025-11-23 07:28:04 - INFO - 
Best architecture by energy:
2025-11-23 07:28:04 - INFO -   Accuracy: 0.9241
2025-11-23 07:28:04 - INFO -   Energy: 975.3772 µJ
2025-11-23 07:28:04 - INFO -   Architecture: {'num_stages': 4, 'blocks_per_stage': 2, 'filters_per_stage': [64, 128, 256, 512], 'mul_map_files': ['./multipliers/mul8u_R92.bin', './multipliers/mul8u_R92.bin', './multipliers/mul8u_R92.bin', './multipliers/mul8u_R92.bin']}
2025-11-23 07:28:04 - INFO - 
STL Constraint Statistics:
2025-11-23 07:28:04 - INFO -   Satisfied: 20/20 (100.0%)
2025-11-23 07:28:04 - INFO -   Violated: 0/20 (0.0%)
2025-11-23 07:28:04 - INFO - 
Pareto-optimal architectures: 7 found
2025-11-23 07:28:04 - INFO - ============================================================
2025-11-23 07:28:04 - INFO - Generating publication-quality plots
2025-11-23 07:28:04 - INFO - ============================================================
2025-11-23 07:28:05 - INFO - All plots generated successfully
2025-11-23 07:28:05 - INFO -   energy_vs_accuracy: plots/resnet_bayesian_60ep_20251123_072804/energy/energy_vs_accuracy.png
2025-11-23 07:28:05 - INFO -   pareto_front: plots/resnet_bayesian_60ep_20251123_072804/energy/pareto_front.png
2025-11-23 07:28:05 - INFO -   stl_analysis: plots/resnet_bayesian_60ep_20251123_072804/stl/stl_analysis.png
2025-11-23 07:28:05 - INFO -   energy_breakdown: plots/resnet_bayesian_60ep_20251123_072804/energy/energy_breakdown.png
2025-11-23 07:28:05 - INFO - 
Results saved to: logs/resnet_bayesian_60ep_20251123_014210_results.json
2025-11-23 07:28:05 - INFO - Log file: logs/resnet_bayesian_60ep_20251123_014210.log
